{
  "episode_id": "MATH-G10-U01-L03",
  "hook": {
    "file": "01_hook/hook.mp4",
    "width": 3840,
    "height": 2160,
    "duration_sec": 1.834,
    "framing": "fit",
    "speech": [
      [
        0.362,
        1.624
      ]
    ],
    "trim_start_sec": 0,
    "trim_end_sec": null,
    "key_word_sec": null,
    "hold_frames": 12
  },
  "voiceover": {
    "mode": "per_line",
    "lines": [
      {
        "id": "L02",
        "file": "vo/L02.wav",
        "duration_sec": 3.267,
        "expected_sec": 2.843,
        "ratio": 1.15
      },
      {
        "id": "L03",
        "file": "vo/L03.wav",
        "duration_sec": 5.577,
        "expected_sec": 3.954,
        "ratio": 1.41
      },
      {
        "id": "L04",
        "file": "vo/L04.wav",
        "duration_sec": 6.159,
        "expected_sec": 3.954,
        "ratio": 1.56
      },
      {
        "id": "L05",
        "file": "vo/L05.wav",
        "duration_sec": 1.116,
        "expected_sec": 0.9,
        "ratio": 1.24
      },
      {
        "id": "L06",
        "file": "vo/L06.wav",
        "duration_sec": 1.665,
        "expected_sec": 1.731,
        "ratio": 0.96
      },
      {
        "id": "L07",
        "file": "vo/L07.wav",
        "duration_sec": 4.256,
        "expected_sec": 2.843,
        "ratio": 1.5
      },
      {
        "id": "L08",
        "file": "vo/L08.wav",
        "duration_sec": 2.766,
        "expected_sec": 1.731,
        "ratio": 1.6
      },
      {
        "id": "L09",
        "file": "vo/L09.wav",
        "duration_sec": 2.624,
        "expected_sec": 2.472,
        "ratio": 1.06
      },
      {
        "id": "L11",
        "file": "vo/L11.wav",
        "duration_sec": 1.908,
        "expected_sec": 2.102,
        "ratio": 0.91
      },
      {
        "id": "L12",
        "file": "vo/L12.wav",
        "duration_sec": 2.135,
        "expected_sec": 2.102,
        "ratio": 1.02
      },
      {
        "id": "L13",
        "file": "vo/L13.wav",
        "duration_sec": 3.958,
        "expected_sec": 3.213,
        "ratio": 1.23
      },
      {
        "id": "L14",
        "file": "vo/L14.wav",
        "duration_sec": 1.909,
        "expected_sec": 1.731,
        "ratio": 1.1
      },
      {
        "id": "L15",
        "file": "vo/L15.wav",
        "duration_sec": 4.461,
        "expected_sec": 3.954,
        "ratio": 1.13
      },
      {
        "id": "L16",
        "file": "vo/L16.wav",
        "duration_sec": 3.256,
        "expected_sec": 2.843,
        "ratio": 1.15
      },
      {
        "id": "L17",
        "file": "vo/L17.wav",
        "duration_sec": 7.649,
        "expected_sec": 5.806,
        "ratio": 1.32
      },
      {
        "id": "L18",
        "file": "vo/L18.wav",
        "duration_sec": 2.965,
        "expected_sec": 1.731,
        "ratio": 1.71
      },
      {
        "id": "L19",
        "file": "vo/L19.wav",
        "duration_sec": 1.569,
        "expected_sec": 1.731,
        "ratio": 0.91
      },
      {
        "id": "L20",
        "file": "vo/L20.wav",
        "duration_sec": 5.677,
        "expected_sec": 4.694,
        "ratio": 1.21
      },
      {
        "id": "L21",
        "file": "vo/L21.wav",
        "duration_sec": 2.006,
        "expected_sec": 1.361,
        "ratio": 1.47
      },
      {
        "id": "L22",
        "file": "vo/L22.wav",
        "duration_sec": 3.413,
        "expected_sec": 2.843,
        "ratio": 1.2
      },
      {
        "id": "L23",
        "file": "vo/L23.wav",
        "duration_sec": 5.697,
        "expected_sec": 4.694,
        "ratio": 1.21
      },
      {
        "id": "L24",
        "file": "vo/L24.wav",
        "duration_sec": 1.997,
        "expected_sec": 1.361,
        "ratio": 1.47
      },
      {
        "id": "L25",
        "file": "vo/L25.wav",
        "duration_sec": 6.418,
        "expected_sec": 4.324,
        "ratio": 1.48
      }
    ]
  },
  "issues": [],
  "agent_notes": ""
}
